"Authors","Author full names","Author(s) ID","Title","Year","Source title","Volume","Issue","Art. No.","Page start","Page end","Cited by","DOI","Link","Abstract","Author Keywords","Index Keywords","Document Type","Publication Stage","Open Access","Source","EID"
"Pancini M.; Camilli M.; Quattrocchi G.; Andrew Tamburri D.","Pancini, Matteo (60090489200); Camilli, Matteo (55320192900); Quattrocchi, Giovanni (57090214300); Andrew Tamburri, Damian (35488974800)","60090489200; 55320192900; 57090214300; 35488974800","Engineering MLOps Pipelines With Data Quality: A Case Study on Tabular Datasets in Kaggle","2025","Journal of Software: Evolution and Process","37","9","e70044","","","1","10.1002/smr.70044","https://www.scopus.com/pages/publications/105015420041?origin=resultslist","Ensuring high-quality data is crucial for the successful deployment of machine learning models, thereby sustaining the operational pipelines around such models. However, a significant number of practitioners do not currently use data quality checks or measurements as gateways for their model construction and operationalization, indicating a need for greater awareness and adoption of these tools. In this study, we propose an automated approach for automating the process of architecting machine learning pipelines by means of (semi-)automated data quality checks. We focus on tabular data as a representative of the most widely used structured data formats in said pipelines. Our work is based on a subset of metrics that are particularly relevant in MLOps pipelines, stemming from our engagement with expert practitioners in machine learning operations (MLOps). We selected Deepchecks, a well-known tool for conducting data quality checks, from a cohort of similar tools to evaluate the quality of datasets collected from Kaggle, a widely used platform for machine learning competitions and data science projects. We also analyze the main features used by Kaggle to rank their datasets and used these features to validate the relevance of our approach. Our approach shows the potential for automated data quality checks to improve the efficiency and effectiveness of MLOps pipelines and their operation, by decreasing the risk of introducing errors and biases into machine learning models in production. © 2025 The Author(s). Journal of Software: Evolution and Process published by John Wiley & Sons Ltd.","data quality; Kaggle; machine learning; MLOps","Data accuracy; Data consistency; Data quality; Data reduction; Learning systems; Machine learning; Pipelines; Quality control; Automated data; Case-studies; Data quality; Engineering machines; Kaggle; Machine learning models; Machine learning operation; Machine-learning; Quality checks; Automation","Article","Final","All Open Access; Green Open Access; Hybrid Gold Open Access","Scopus","2-s2.0-105015420041"
"","","","18th European Conference on Software Architecture, ECSA 2024","2024","Lecture Notes in Computer Science (including subseries Lecture Notes in Artificial Intelligence and Lecture Notes in Bioinformatics)","14937 LNCS","","","","","0","","https://www.scopus.com/pages/publications/85204406874?origin=resultslist","The proceedings contain 42 papers. The special focus in this conference is on Software Architecture. The topics include: Automated Architecture Recovery for Embedded Software Systems: An Industrial Case Study; An Analysis of MLOps Architectures: A Systematic Mapping Study; attention-Based Method for Design Pattern Detection; cause-Effect Chain-Based Diagnosis of Automotive Onboard Energy Systems; architecture-Based Issue Propagation Analysis; MDEPT: Microservices Design Evaluator and Performance Tester; exploring Architectural Evolution in Microservice Systems Using Repository Mining Techniques and Static Code Analysis; temporal Community Detection in Developer Collaboration Networks of Microservice Projects; uncertainty Calculation-as-a-Service: Microservice-Based Metrology Applications; performance Impact of Microservice Granularity Decisions: An Empirical Evaluation Using the Service Weaver Framework; improving Comprehensibility of Event-Driven Microservice Architectures by Graph-Based Visualizations; energy Consumption of IoT Monitoring Software Architectures in the Edge; software Architecture Assessment for Sustainability: A Case Study; modeling and Analyzing Zero Trust Architectures Regarding Performance and Security; towards Secure Management of Edge-Cloud IoT Microservices Using Policy as Code; electric Vehicle Fast-Charging Software: Architectural Considerations Towards Trustworthiness; exploring Architectural Design Decisions in Mailing Lists and Their Traceability to Issue Trackers; Helping Novice Architects to Make Quality Design Decisions Using an LLM-Based Assistant; architecture Decision Records in Practice: An Action Research Study; towards Teamwise Informed Decisions On Microservice Security Smells; automated Quality Concerns Extraction from User Stories and Acceptance Criteria for Early Architectural Decisions; SCATS Framework for Software Integration in Software-Defined Vehicle with Cross-Organizational Agile Teams; the Execution Perspective in Software Architecture Descriptions: A Systematic Mapping; architectural Views: The State of Practice in Open-Source Software Projects.","","","Conference review","Final","","Scopus","2-s2.0-85204406874"
"Kavanagh K.","Kavanagh, Kieran (60219295800)","60219295800","Google Machine Learning and Generative AI for Solutions Architects: ​Build efficient and scalable AI/ML solutions on Google Cloud","2024","Google Machine Learning and Generative AI for Solutions Architects: ​Build efficient and scalable AI/ML solutions on Google Cloud","","","","1","552","2","","https://www.scopus.com/pages/publications/105023456416?origin=resultslist","Most companies today are incorporating AI/ML into their businesses. Building and running apps utilizing AI/ML effectively is tough. This book, authored by a principal architect with about two decades of industry experience, who has led cross-functional teams to design, plan, implement, and govern enterprise cloud strategies, shows you exactly how to design and run AI/ML workloads successfully using years of experience from some of the world's leading tech companies. You'll get a clear understanding of essential fundamental AI/ML concepts, before moving on to complex topics with the help of examples and hands-on activities. This will help you explore advanced, cutting-edge AI/ML applications that address real-world use cases in today's market. You'll recognize the common challenges that companies face when implementing AI/ML workloads, and discover industry-proven best practices to overcome these. The chapters also teach you about the vast AI/ML landscape on Google Cloud and how to implement all the steps needed in a typical AI/ML project. You'll use services such as BigQuery to prepare data; Vertex AI to train, deploy, monitor, and scale models in production; as well as MLOps to automate the entire process. By the end of this book, you will be able to unlock the full potential of Google Cloud's AI/ML offerings. © 2024 Packt Publishing. All rights reserved.","","Artificial intelligence; Best practices; Cross-functional teams; Cutting edges; Design plans; Google+; Hands-on activities; Industry experience; Machine-learning; Real-world; Train model; Information systems","Book","Final","","Scopus","2-s2.0-105023456416"
"Myakala R.K.; Nagata P.K.; Lavudya S.; Pedhapally S.K.; Podduturi V.R.","Myakala, Raj Kumar (60421998600); Nagata, Praveen Kumar (60421858200); Lavudya, Sampath (60421858300); Pedhapally, Sanjeev Kumar (60422855500); Podduturi, Vinithya Reddy (60422280000)","60421998600; 60421858200; 60421858300; 60422855500; 60422280000","AutoDrift: A Forecast-Aware Concept Drift Detection and Retraining Pipeline in MLOps with CMAPSS","2025","Proceedings of the IEEE International Conference on Big Data Computing Service and Applications, BigDataService","","2025","","94","100","0","10.1109/BigDataService65758.2025.00019","https://www.scopus.com/pages/publications/105031397681?origin=resultslist","Concept drift poses a critical challenge to deploying reliable machine learning models in real-world production environments, particularly in time series forecasting and predictive maintenance systems. We present AutoDrift, a modular, forecast-aware framework to detect concept drift and trigger the automated retraining of models within modern MLOps pipelines. This approach integrates Facebook Prophet for time series prediction, statistical drift detection techniques such as the Kolmogorov-Smirnov test, and Apache Airflow to orchestrate retraining and deployment tasks in response to detected drift. Using the widely bench marked NASA CMAPSS dataset, we simulate real-world engine degradation and sensor drift conditions to evaluate AutoDrift's effectiveness in predictive maintenance scenarios. The results demonstrate that AutoDrift maintains high forecasting accuracy (91% precision) while reducing retraining latency by 37% compared to static retraining schedules. The framework supports model versioning via MLflow and is cloud-agnostic, enabling seamless deployment across Kubernetes, AWS, and on-premises environments. AutoDrift offers a practical solution to one of the most pressing MLOps challenges such as maintaining the adaptability of deployed models to changing data distributions, by unifying drift detection, retraining logic, and orchestration in a single, extensible pipeline. The system is designed to be interpretable, scalable, and easy to integrate into existing machine learning operations, making it suitable for industrial applications in aviation, IoT, and large-scale telemetry monitoring.  © 2025 IEEE.","Anomaly Detection; Apache Airflow; CI/CD Automation; CMAPSS; Concept Drift; Forecasting; MLOps; Model Retraining; Predictive Maintenance; Time Series","Anomaly detection; Automation; Distributed computer systems; Learning systems; Machine learning; Pipelines; Predictive maintenance; Anomaly detection; Apache airflow; CI/CD automation; CMAPSS; Concept drifts; MLOp; Model retraining; Predictive maintenance; Real-world; Times series; Forecasting; Time series","Conference paper","Final","","Scopus","2-s2.0-105031397681"
"Granlund T.; Kopponen A.; Stirbu V.; Myllyaho L.; Mikkonen T.","Granlund, Tuomas (57217017714); Kopponen, Aleksi (57222809042); Stirbu, Vlad (57249175700); Myllyaho, Lalli (57211425624); Mikkonen, Tommi (57220096141)","57217017714; 57222809042; 57249175700; 57211425624; 57220096141","MLOps challenges in multi-organization setup: Experiences from two real-world cases","2021","Proceedings - 2021 IEEE/ACM 1st Workshop on AI Engineering - Software Engineering for AI, WAIN 2021","","","9474388","82","88","39","10.1109/WAIN52551.2021.00019","https://www.scopus.com/pages/publications/85113229645?origin=resultslist","The emerging age of connected, digital world means that there are tons of data, distributed to various organizations and their databases. Since this data can be confidential in nature, it cannot always be openly shared in seek of artificial intelligence (AI) and machine learning (ML) solutions. Instead, we need integration mechanisms, analogous to integration patterns in information systems, to create multi-organization AI/ML systems. In this paper, we present two real-world cases. First, we study integration between two organizations in detail. Second, we address scaling of AI/ML to multi-organization context. The setup we assume is that of continuous deployment, often referred to DevOps in software development. When also ML components are deployed in a similar fashion, term MLOps is used. Towards the end of the paper, we list the main observations and draw some final conclusions. Finally, we propose some directions for future work.  © 2021 IEEE.","Artificial intelligence, AI; information systems; integration; machine learning, ML; multi-organisation; software engineering for AI/ML","Distributed database systems; Integration; Software design; Digital world; Integration mechanisms; Integration patterns; Real-world; Artificial intelligence","Conference paper","Final","All Open Access; Green Open Access","Scopus","2-s2.0-85113229645"
"El-Hajj M.","El-Hajj, Mohammed (57202650418)","57202650418","Beyond the Generalization Illusion: A Production MLOps Framework for Federated Behavioral Malware Detection with Real-Time Drift Adaptation","2025","2025 9th Cyber Security in Networking Conference: GenAI and Cybersecurity, CSNet 2025","","","","215","221","0","10.1109/CSNet67572.2025.11288242","https://www.scopus.com/pages/publications/105032054610?origin=resultslist","This paper identifies critical limitations in current behavioral malware detection systems, particularly the”generalization illusion” where high laboratory accuracy fails to translate to novel threats in operational environments. Through comprehensive literature analysis across 42 recent studies, we identify three fundamental research gaps: (1) inadequate evaluation protocols that overestimate real-world performance by 12.3% through conventional random-split validation, (2) privacy constraints preventing effective collaborative threat intelligence sharing across organizations, and (3) operational fragility against concept drift where models rapidly degrade as malware behaviors evolve. We propose a novel framework integrating Leave-One-Experiment-Out (LOEO) validation for proper generalization assessment, privacy-preserving federated learning for collaborative security without raw data sharing, and real-time drift detection with automated retraining mechanisms. Our methodology establishes a production-grade MLOps implementation that demonstrates enterprise scalability through containerized microservices architecture. This methodology paper establishes the theoretical foundation for addressing these challenges, with comprehensive empirical validation across 2.74 million behavioral samples from 104 malware experiments to follow in subsequent work. © 2025 IEEE.","Behavioral malware detection; Concept drift adaptation; Federated learning; Generalization illusion; Leave-One-Experiment-Out; Methodological framework; Privacy-preserving","Behavioral research; Collaborative learning; Data Sharing; Distributed computer systems; Privacy-preserving techniques; Behavioral malware detection; Concept drift adaptation; Concept drifts; Generalisation; Generalization illusion; Leave-one-experiment-out; Malware detection; Methodological frameworks; Privacy preserving; Real- time; Malware","Conference paper","Final","","Scopus","2-s2.0-105032054610"
"Theusch F.; Seemann L.; Guldner A.; Naumann S.; Bergmann R.","Theusch, Felix (58344316300); Seemann, Lukas (59658511300); Guldner, Achim (56768251200); Naumann, Stefan (27067840500); Bergmann, Ralph (57193551665)","58344316300; 59658511300; 56768251200; 27067840500; 57193551665","Towards machine learning-based digital twins in cyber-physical systems","2023","CEUR Workshop Proceedings","3541","","","1","16","3","","https://www.scopus.com/pages/publications/85177077569?origin=resultslist","The use of Artificial Intelligence, and especially Machine Learning methods, promise to play key roles in the development of Digital Twins due to their outstanding properties in processing large IoT data streams. However, so far, there is a lack of research on the systematisation of Machine Learning-based Digital Twins (MLDTs) as well as on their methodological development and implementation processes in productive environments. The scientific literature describes various applications of MLDTs-even if they are not called this way-and specialised methods and architectures, but a generic reference model is still missing. Therefore, this paper proposes a systematisation of the characteristics of MLDTs and their specific challenges. Furthermore, a first proposal of a process model for the systematic development of MLTDs according to the Machine Learning Operations (MLOps) paradigm is presented as a tentative instance of a future reference model for MLDTs. We incorporate established software development methods as well as insights gained from the examination of several industrial applications in the field of water resource management, one of which we present during the paper. We expect that the process model allows practitioners to consistently develop and maintain MLDTs and researchers to find potentials and research gaps.  © 2023 Copyright for this paper by its authors.","Characterisation; Digital Twin; Machine Learning; MLOps; Process Model; Water Resource Management","Application programs; Cyber Physical System; Data handling; E-learning; Embedded systems; Learning systems; Resource allocation; Software design; Water management; Characterization; Cybe-physical systems; Cyber-physical systems; Machine learning operation; Machine-learning; Process-models; Reference modeling; Systematisation; Water resources management; Machine learning","Conference paper","Final","","Scopus","2-s2.0-85177077569"
"Kampakis S.","Kampakis, Stylianos (54403025700)","54403025700","Machine Learning in the Real World","2022","Encyclopedia of Data Science and Machine Learning","","","","1732","1747","0","10.4018/978-1-7998-9220-5.ch104","https://www.scopus.com/pages/publications/85188061005?origin=resultslist","Most data scientists and machine learning practitioners focus on algorithm development and implementation. However, the proper and successful application of data science in an organisation cannot be separated from business objectives and organisational dynamics. This way of thinking, however, can feel foreign to many data scientists who focus mostly on technical details. The goal of this article is to outline some of the considerations that a data scientist needs to take into account when implementing data science within an organisation. More specifically, this article discusses the topics of data strategy, data science processes, and some recent developments like MLOps. © 2023 by IGI Global. All rights reserved.","","","Book chapter","Final","","Scopus","2-s2.0-85188061005"
"Matrenin P.V.; Iumanova I.F.; Khalyasmaa A.I.","Matrenin, Pavel V. (56826034700); Iumanova, Irina F. (60423102400); Khalyasmaa, Alexandra I. (55161912000)","56826034700; 60423102400; 55161912000","Conceptual Architecture of a Trustworthy Wind and Photovoltaic Power Forecasting System: A Systematic Review and Design","2026","Inventions","11","1","15","","","0","10.3390/inventions11010015","https://www.scopus.com/pages/publications/105031415330?origin=resultslist","Accurate and trustworthy forecasting of wind and photovoltaic power generation is essential for the reliable operation and planning of modern power systems. Although recent machine-learning-based forecasting solutions increasingly incorporate elements of trustworthy artificial intelligence, such as explainability, uncertainty quantification, robustness, drift monitoring, and machine learning operations, these components are typically introduced in a fragmented manner and remain weakly integrated at the architectural level, which limits their applicability in real operational environments. This paper presents a systematic review of 59 peer-reviewed journal articles published between 2019 and 2025, conducted in accordance with the PRISMA 2020 guidelines. The review includes studies focused on wind and photovoltaic power forecasting that report system architectures, frameworks, or end-to-end pipelines incorporating at least one trust-related attribute. The literature search was performed using Scopus, IEEE Xplore, MDPI, and ScienceDirect. Using a narrative and architectural synthesis, the review identifies six structural gaps hindering industrial deployment: the absence of semantic data models, shallow model-centric explainability, drift monitoring without governance mechanisms, lack of automated model lifecycle management, insufficient robustness to real-world data defects, and the absence of integrated end-to-end architectures. The evidence base is limited by the heterogeneity of architectural descriptions and the predominantly qualitative nature of reported implementations. Based on these findings, a high-level reference architecture for a trustworthy AI-based forecasting system is proposed. The architecture formalizes trustworthiness as a system-level property and integrates semantic, technological, and functional trust layers within a unified data and model lifecycle, supporting reproducible, interpretable, and operationally reliable forecasting for both wind and photovoltaic power plants. © 2026 by the authors.","drift monitoring; explainable AI; MLOps; photovoltaic forecasting; semantic modeling; trustworthy AI; uncertainty quantification; wind power forecasting","Architecture; Computer architecture; Information management; Learning systems; Life cycle; Machine learning; Technological forecasting; Drift monitoring; Explainable AI; MLOp; Photovoltaic forecasting; Photovoltaic power; Photovoltaics; Semantic modelling; Trustworthy AI; Uncertainty quantifications; Wind power forecasting; Semantics","Review","Final","All Open Access; Gold Open Access","Scopus","2-s2.0-105031415330"
"John M.M.; Olsson H.H.; Bosch J.; Gillblad D.","John, Meenu Mary (57126758000); Olsson, Helena Holmstrom (24335916300); Bosch, Jan (56675290800); Gillblad, Daniel (35812056300)","57126758000; 24335916300; 56675290800; 35812056300","Exploring Trade-Offs in MLOps Adoption","2023","Proceedings - Asia-Pacific Software Engineering Conference, APSEC","","","","369","375","4","10.1109/APSEC60848.2023.00047","https://www.scopus.com/pages/publications/85190507464?origin=resultslist","Machine Learning Operations (MLOps) play a crucial role in the success of data science projects in companies. However, despite its obvious benefits, several companies struggle to adopt MLOps practices and face difficulty in deciding how to deploy and evolve ML models. To gain a deeper understanding of these challenges, we conduct a multi-case study involving nine practitioners from seven companies. Based on our empirical results, we identify the key trade-offs we see companies make when adopting MLOps. We categorise these trade-offs into four concerns of the BAPO model: Business, Architecture, Process, and Organisation. Finally, we provide suggestions to mitigate the identified trade-offs. By identifying and detailing these trade-offs and the implications of these, this research helps companies to ensure the successful adoption of MLOps. © 2023 IEEE.","BAPO model; MLOps; Multi-case study; Trade-offs","Commerce; BAPO model; Business architecture; Business organizations; Business Process; Case-studies; Machine learning operation; Machine-learning; Multi-case study; Science projects; Trade off; Economic and social effects","Conference paper","Final","","Scopus","2-s2.0-85190507464"
"Srinivasan V.; Jayanthi R.; Avinash R.; Chethan","Srinivasan, V. (36663167300); Jayanthi, R. (59521964100); Avinash, R. (60105720700); Chethan (60605279700)","36663167300; 59521964100; 60105720700; 60605279700","Model Drift Detection and Automated Retraining in Production ML System","2025","Proceedings of the 6th International Conference on Smart Electronics and Communication, ICOSEC 2025","","","","1560","1564","0","10.1109/ICOSEC67334.2025.11459598","https://www.scopus.com/pages/publications/105037194804?origin=resultslist","This paper presents DRIFT-ACT (Drift-Aware Continuous Training), a practical and modular framework designed to tackle the persistent challenge of model performance degradation in real-world AI systems. DRIFT-ACT combines real-time drift detection using lightweight statistical monitoring techniques with automated retraining pipelines powered by MLOps tools. Instead of modifying the core model architecture, DRIFT-ACT operates as a thin, flexible layer on top of existing systems monitoring, detecting, and adapting to shifts in data or concept distributions without human intervention. Tested across synthetic and real-world production scenarios, DRIFT-ACT significantly improves model robustness over time, reduces manual maintenance effort, and ensures sustained performance consistency. Beyond the technical solution, this work serves as a practical blueprint for deploying resilient ML systems in dynamic, high-impact environments.  © 2025 IEEE.","Automated Retraining; CI/CD; Concept Drift; Data Drift; Evidently AI (key words); MLflow; MLOps; Model Drift; Monitoring","Human computer interaction; Real time systems; Automated retraining; CI/CD; Concept drifts; Data drift; Evidently AI (key word); Key words; Mlflow; MLOp; Model drift; Real-world; Automation","Conference paper","Final","","Scopus","2-s2.0-105037194804"
