"Authors","Author full names","Author(s) ID","Title","Year","Source title","Volume","Issue","Art. No.","Page start","Page end","Cited by","DOI","Link","Abstract","Author Keywords","Index Keywords","Document Type","Publication Stage","Open Access","Source","EID"
"Alridha A.H.; Abd Alsharify F.H.; Al-Khafaji Z.","Alridha, Ahmed Hasan (57222472901); Abd Alsharify, Fouad H. (57226714121); Al-Khafaji, Zahir (57193092254)","57222472901; 57226714121; 57193092254","A Review of Optimization Techniques: Applications and Comparative Analysis","2024","Iraqi Journal for Computer Science and Mathematics","5","2","","122","134","14","10.52866/ijcsm.2024-05-02-011","https://www.scopus.com/pages/publications/85197098752?origin=resultslist","Optimization algorithms exist to find solutions to various problems and then find out the optimal solutions. These algorithms are designed to reach desired goals with high accuracy and low error, as well as improve performance in various fields, including machine learning, operations research, physics, chemistry, and engineering. As technology continues to advance, optimization algorithms are increasingly needed to address complex real-world challenges and drive innovation across all disciplines. Quantitative leaps have been achieved in improving the efficiency of optimization algorithms through the diversity of sources of information feeding these algorithms according to the type of optimization problem, based on scientific and organized foundations. The objectives of this paper are to discuss the most important optimization algorithms, classify the scientific fields involved in their application, and optimize problems involved in this regard, in addition to providing a brief overview for comparison among these algorithms. © 2024 College of Education, Al-Iraqia University. All rights reserved.","algorithm classification; applications field; comparison approach; Optimization algorithms","Machine learning; Optimization; Algorithm classification; Application analysis; Application fields; Comparative analyzes; Comparison approach; High-accuracy; High-low; Optimal solutions; Optimization algorithms; Optimization techniques; Operations research","Article","Final","All Open Access; Gold Open Access","Scopus","2-s2.0-85197098752"
"Tripathy B.K.; Reddy Maddikunta P.K.; Pham Q.-V.; Gadekallu T.R.; Dev K.; Pandya S.; Elhalawany B.M.","Tripathy, B.K. (7006285374); Reddy Maddikunta, Praveen Kumar (57219858463); Pham, Quoc-Viet (56884048100); Gadekallu, Thippa Reddy (57217062630); Dev, Kapal (57190336390); Pandya, Sharnil (57200178916); Elhalawany, Basem M. (55332056600)","7006285374; 57219858463; 56884048100; 57217062630; 57190336390; 57200178916; 55332056600","Harris Hawk Optimization: A Survey onVariants and Applications","2022","Computational Intelligence and Neuroscience","2022","","2218594","","","69","10.1155/2022/2218594","https://www.scopus.com/pages/publications/85133560763?origin=resultslist","In this review, we intend to present a complete literature survey on the conception and variants of the recent successful optimization algorithm, Harris Hawk optimizer (HHO), along with an updated set of applications in well-established works. For this purpose, we first present an overview of HHO, including its logic of equations and mathematical model. Next, we focus on reviewing different variants of HHO from the available well-established literature. To provide readers a deep vision and foster the application of the HHO, we review the state-of-the-art improvements of HHO, focusing mainly on fuzzy HHO and a new intuitionistic fuzzy HHO algorithm. We also review the applications of HHO in enhancing machine learning operations and in tackling engineering optimization problems. This survey can cover different aspects of HHO and its future applications to provide a basis for future research in the development of swarm intelligence paths and the use of HHO for real-world problems. © 2022 B. K. Tripathy et al.","","Algorithms; Animals; Artificial Intelligence; Falconiformes; Machine Learning; Models, Theoretical; Fuzzy sets; Machine learning; Optimization; Engineering optimization problems; Future applications; Intuitionistic fuzzy; Literature survey; Machine-learning; Optimisations; Optimization algorithms; Optimizers; Real-world problem; State of the art; algorithm; animal; artificial intelligence; Falconiformes; machine learning; theoretical model; Surveys","Review","Final","All Open Access; Green Open Access; Hybrid Gold Open Access","Scopus","2-s2.0-85133560763"
"Nguyen Huynh Anh V.","Nguyen Huynh Anh, Vu (60565097400)","60565097400","A Goal-Oriented MLOps Approach for Developing Microservices-Based Small Language Models Systems","2026","Smart Innovation, Systems and Technologies","465 SIST","","","125","136","0","10.1007/978-3-032-12830-0_11","https://www.scopus.com/pages/publications/105029656147?origin=resultslist","This paper describes an adaptive approach to developing machine learning operations platforms that incorporates goal-oriented requirement engineering using an organizational modeling framework, microservice architecture principles, and small language models. We demonstrate this method with a case study of a machine learning workflow management application. The proposed model enables more efficient integration of artificial intelligence capabilities while maintaining system modularity, scalability, and alignment with stakeholder needs and expectations. Our results show that the goal-oriented MLOps approach for microservices-based systems provides considerable benefits in managing complex machine learning workflows, particularly when incorporating several artificial intelligence services with different features and requirements. © The Author(s), under exclusive license to Springer Nature Switzerland AG 2026.","IT/Business Alignment; Microservices Architecture; MLOps; Organizational Modeling; Small Language Models","Learning systems; Machine learning; Adaptive approach; Goal-oriented; IT-business alignments; Language model; Machine-learning; Microservice architecture; MLOp; Modelling systems; Organizational models; Small language model; Modeling languages","Conference paper","Final","","Scopus","2-s2.0-105029656147"
"Horsky J.W.; Saghiri A.M.","Horsky, Jack William (60611306500); Saghiri, Ali Mohammad (24598183400)","60611306500; 24598183400","Low-Code and No-Code Platforms for Linux System Administration: A SWOT Analysis","2026","International Conference on Artificial Intelligence, Computer, Data Sciences, and Applications, ACDSA 2026","","","","","","0","10.1109/ACDSA67686.2026.11467789","https://www.scopus.com/pages/publications/105037596656?origin=resultslist","We present a structured SWOT (Strengths, Weaknesses, Opportunities, Threats) analysis of low-code and no-code (LCNC) platforms for Linux system administration. We compare n8n, Zapier, and Make.com as representative LCNC platforms and focus on n8n because it can be self-hosted and is easily extensible. Using hands-on experiments and case studies in monitoring and service management, we compare the benefits of LCNC workflows with traditional mechanisms that rely on Bash scripting, cron and systemd timers, Python programs, and Ansible- based configuration management. Our study is guided by explicit research questions on task fit, integrability, observability, security, cost, and architecture. We complement the qualitative SWOT analysis with a simple cost-benefit discussion and lightweight performance measurements (CPU usage and end-toend latency) for representative workflows. We also comment on how LCNC platforms can orchestrate AI/ML and MLOps-style tasks in Linux environments. Our findings show that LCNC accelerates integration, centralizes credentials, and improves visibility through execution histories and traceable runs, while code-centric approaches remain stronger for tight control loops, deep service tuning, and deterministic convergence. The evidence favors hybrid architectures in which LCNC orchestrates triggers, routing, AI/ML calls, and approvals, while native Linux tools execute performance-sensitive operations. To our knowledge, this is the first study to provide a dedicated, Linux-focused SWOT analysis of LCNC platforms grounded in concrete administration tasks. © 2026 IEEE.","Automation; Linux administration; Low-code; n8n; No-code; Observability; Security; SWOT analysis","Codes (symbols); Cost benefit analysis; Linux; Linux administration; Linux systems; Low-code; N8n; No-code; Security; Strength, weakness, opportunity, threat analyze; Strengths/weakness/opportunities/threats; System administration; Threats analysis; Automation","Conference paper","Final","","Scopus","2-s2.0-105037596656"
"Vrbančič G.; Lahovnik Z.; Podgorelec V.","Vrbančič, Grega (57203904867); Lahovnik, Zala (59483342400); Podgorelec, Vili (6701496970)","57203904867; 59483342400; 6701496970","Quality Assurance of Predictive Models in Intelligent Systems","2025","CEUR Workshop Proceedings","4077","","","","","0","","https://www.scopus.com/pages/publications/105021805085?origin=resultslist","Predictive models are becoming an integral part of modern information systems, transforming them into intelligent systems, featuring automated, data-driven decision-making across various domains. However, the reliance of intelligent systems on the evolving data streams and advanced machine learning algorithms introduces unique quality assurance (QA) challenges. This paper provides insight into systematic approaches for ensuring the reliability and robustness of predictive models, emphasizing the role of Machine Learning Operations practices. It addresses critical QA aspects such as data validation, drift detection, and model testing methodologies. A detailed case study of the Airly platform, a solution for air quality prediction, demonstrates practical implementations of these principles, including automated data pipelines, rigorous statistical validation, data version control, and continuous model monitoring. The study demonstrates the necessity of structured, automated, and integrated QA pipelines to maintain model performance throughout the intelligent system life cycle. © 2025 Copyright for this paper by its authors. Use permitted under Creative Commons License Attribution 4.0 International (CC BY 4.0).","Intelligent systems; Machine Learning Operations (MLOps); Predictive models; Quality assurance","Automation; Data quality; Decision making; Intelligent systems; Learning algorithms; Learning systems; Life cycle; Machine learning; Prediction models; Quality control; Automated data; Data driven decision; Data stream; Decisions makings; Integral part; Machine learning algorithms; Machine learning operation; Machine-learning; Predictive models; Reliability and robustness; Quality assurance","Conference paper","Final","","Scopus","2-s2.0-105021805085"
"Zhao X.","Zhao, Xiaofei (59586649600)","59586649600","Composable Assurance for AI Alignment: A Framework for Propagating Formal Safety Properties Through MLOps","2026","Proceedings of the AAAI Conference on Artificial Intelligence","40","44","","38129","38136","0","10.1609/aaai.v40i44.41151","https://www.scopus.com/pages/publications/105034966080?origin=resultslist","The increasing complexity of modern AI systems exposes a significant assurance gap: safety evidence from practices like red-teaming and robustness testing remains fragmented, lacking a formal mechanism for composition and propagation throughout the development lifecycle. This prevents the construction of rigorous, dynamic safety cases essential for trustworthy AI. We introduce the Composable Assurance Framework (CAF), a novel engineering methodology that integrates safety assurance directly into MLOps workflows. At its core is the Formal Safety Assertion (FSA), a standardized, machine-readable structure that verifiably links safety properties—such as robustness scores or the absence of deceptive circuits—to specific AI artifacts. We then define a Composition Calculus, a set of formal rules governing how FSAs are propagated and aggregated as components are combined into a system. This approach transforms the development pipeline into an automated evidence-gathering engine, whose output is a dynamic Directed Acyclic Graph (DAG) of assertions that constitutes a living safety case. Through a prototype and a Retrieval-Augmented Generation (RAG) case study, we demonstrate how CAF automatically enforces a predefined safety policy, blocking non-compliant deployments. © 2026, Association for the Advancement of Artificial Intelligence (www.aaai.org). All rights reserved.","","Artificial intelligence; Life cycle; Safety engineering; Safety testing; AI systems; Composable; Engineering methodology; Formal safety; Red teaming; Robustness testing; Safety assurance; Safety case; Safety evidences; Safety property; Directed graphs","Conference paper","Final","All Open Access; Gold Open Access","Scopus","2-s2.0-105034966080"
"Akbasli I.T.; Birbilen A.Z.; Teksam O.","Akbasli, Izzet Turkalp (57222142626); Birbilen, Ahmet Ziya (56179298000); Teksam, Ozlem (6602509574)","57222142626; 56179298000; 6602509574","Artificial intelligence-driven forecasting and shift optimization for pediatric emergency department crowding","2025","JAMIA Open","8","2","ooae138","","","14","10.1093/jamiaopen/ooae138","https://www.scopus.com/pages/publications/105001045726?origin=resultslist","Objective: This study aimed to develop and evaluate an artificial intelligence (AI)-driven system for forecasting Pediatric Emergency Department (PED) overcrowding and optimizing physician shift schedules using machine learning operations (MLOps). Materials and Methods: Data from 352 843 PED admissions between January 2018 and May 2023 were analyzed. Twenty time-series forecasting models—including classical methods and advanced deep learning architectures like Temporal Convolutional Network, Time-series Dense Encoder and Reversible Instance Normalization, Neural High-order Time Series model, and Neural Basis Expansion Analysis—were developed and compared using Python 3.8. Starting in January 2023, an MLOps simulation automated data updates and model retraining. Shift schedules were optimized based on forecasted patient volumes using integer linear programming. Results: Advanced deep learning models outperformed traditional models, achieving initial R2 scores up to 75%. Throughout the simulation, the median R2 score for all models was 44% after MLOps-based model selection, the median R2 improved to 60%. The MLOps architecture facilitated continuous model updates, enhancing forecast accuracy. Shift optimization adjusted staffing in 69 out of 84 shifts, increasing physician allocation by up to 30.4% during peak hours. This adjustment reduced the patient-to-physician ratio by an average of 4.32 patients during the 8-16 shift and 4.40 patients during the 16-24 shift. Discussion: The integration of advanced deep learning models with MLOps architecture allowed for continuous model updates, enhancing the accuracy of PED overcrowding forecasts and outperforming traditional methods. The AI-driven system demonstrated resilience against data drift caused by events like the COVID-19 pandemic, adapting to changing conditions. Optimizing physician shifts based on these forecasts improved workforce distribution without increasing staff numbers, reducing patient load per physician during peak hours. However, limitations include the single-center design and a fixed staffing model, indicating the need for multicenter validation and implementation in settings with dynamic staffing practices. Future research should focus on expanding datasets through multicenter collaborations and developing forecasting models that provide longer lead times without compromising accuracy. Conclusions: The AI-driven forecasting and shift optimization system demonstrated the efficacy of integrating AI and MLOps in predicting PED overcrowding and optimizing physician shifts. This approach outperformed traditional methods, highlighting its potential for managing overcrowding in emergency departments. Future research should focus on multicenter validation and real-world implementation to fully leverage the benefits of this innovative system. © The Author(s) 2025. Published by Oxford University Press on behalf of the American Medical Informatics Association.","artificial intelligence; forecasting; machine learning operations; overcrowding; Pediatric Emergency Department; shift optimization; time-series analysis","Article; artificial intelligence; automation; child; controlled study; coronavirus disease 2019; crowding (area); data accuracy; deep learning; emergency ward; female; forecasting; health workforce; hospital admission; human; long short term memory network; machine learning; major clinical study; male; medical staff; pandemic; patient volume; physician; predictive model; preschool child; recurrent neural network; shift schedule; simulation; system analysis; time series analysis","Article","Final","All Open Access; Gold Open Access; Green Open Access","Scopus","2-s2.0-105001045726"
"Heck P.","Heck, Petra (36741406800)","36741406800","What about the data? A Mapping study on data engineering for ai systems","2024","Proceedings - 2024 IEEE/ACM 3rd International Conference on AI Engineering - Software Engineering for AI, CAIN 2024","","","","43","52","11","10.1145/3644815.3644954","https://www.scopus.com/pages/publications/85196481905?origin=resultslist","AI systems cannot exist without data. Now that AI models (data science and AI) have matured and are readily available to apply in practice, most organizations struggle with the data infrastructure to do so. There is a growing need for data engineers that know how to prepare data for AI systems or that can setup enterprise-wide data architectures for analytical projects. But until now, the data engineering part of AI engineering has not been getting much attention, in favor of discussing the modeling part. In this paper we aim to change this by perform a mapping study on data engineering for AI systems, i.e., AI data engineering. We found 25 relevant papers between January 2019 and June 2023, explaining AI data engineering activities. We identify which life cycle phases are covered, which technical solutions or architectures are proposed and which lessons learned are presented. We end by an overall discussion of the papers with implications for practitioners and researchers. This paper creates an overview of the body of knowledge on data engineering for AI. This overview is useful for practitioners to identify solutions and best practices as well as for researchers to identify gaps. © 2024 Copyright is held by the owner/author(s). Publication rights licensed to ACM.","AI engineering; data architecture; data engineering; data quality; data-centric AI; DataOps; MLOps","Life cycle; Technology transfer; AI engineering; AI systems; Data architectures; Data centric; Data engineering; Data quality; Data-centric AI; Dataops; Mapping studies; MLOp; Mapping","Conference paper","Final","All Open Access; Gold Open Access; Green Open Access","Scopus","2-s2.0-85196481905"
"John M.M.; Olsson H.H.; Bosch J.","John, Meenu Mary (57126758000); Olsson, Helena Holmström (24335916300); Bosch, Jan (56675290800)","57126758000; 24335916300; 56675290800","An empirical guide to MLOps adoption: Framework, maturity model and taxonomy","2025","Information and Software Technology","183","","107725","","","8","10.1016/j.infsof.2025.107725","https://www.scopus.com/pages/publications/105000919303?origin=resultslist","Context: Machine Learning Operations (MLOps) has become a top priority for companies. However, its adoption has become challenging due to the need for proper guidance and awareness. Most of the MLOps solutions available in the market are designed to fit the specific platform, tools and culture of the providers. Objective: The objective is to develop a structured approach to adopting, assessing and advancing MLOps adoption. Methods: The study was conducted based on a multi-case study across fourteen companies. Results: We provide a comprehensive analysis that highlights the similarities and differences in the adoption of MLOps practices among companies. We have also empirically validated the developed MLOps framework and MLOps maturity model. Furthermore, we carefully reviewed the feedback received from practitioners and revised the MLOps framework and maturity model to confirm its effectiveness. Additionally, we develop an MLOps taxonomy for classifying ML use cases based on their context and requirements into the desired stage of the MLOps framework and maturity model. Conclusion: The findings provide companies with a structured approach to adopt, assess, and further advance the adoption of MLOps practices regardless of their current status. © 2025 The Authors","Framework; Maturity model; MLOps; Multi-case study; Taxonomy","Adoption framework; Case-studies; Framework; Framework models; Machine learning operation; Machine-learning; Maturity model; Maturity taxonomies; Multi-case study; Structured approach","Article","Final","All Open Access; Green Open Access; Hybrid Gold Open Access","Scopus","2-s2.0-105000919303"
"Kashiyama M.; Hirokawa M.; Matsuno R.; Sakuma K.; Itoh T.","Kashiyama, Miyu (59390170400); Hirokawa, Masakazu (36548153500); Matsuno, Ryuta (57216897836); Sakuma, Keita (58549222800); Itoh, Takayuki (35373203100)","59390170400; 36548153500; 57216897836; 58549222800; 35373203100","ScaffoldViz: Interactive 3D visualization of ensemble decision trees based on relationship between weak learners","2025","Information Visualization","24","4 Special Issue: Visualization, Visual Analytics, and Explainability","","320","335","0","10.1177/14738716251335553","https://www.scopus.com/pages/publications/105004432392?origin=resultslist","Ensemble learning that combines multiple weak learners for enhanced performance, is widely used but suffers from low interpretability and explainability. Low interpretability hinders the identification of factors contributing to model inaccuracies, such as overfitting or underfitting, which are critical considerations in the operation of machine learning models. Additionally, this leads challenges not only in operational aspects like model maintenance and quality assurance but also in addressing societal needs such as fairness and privacy. This study focuses on the relationships among weak learners within an ensemble model and proposes a novel visualization method to enhance understanding of the model’s structure and learning process. In this paper, we propose ScaffoldViz, a system that defines relationships among weak learners based on “common samples” in gradient boosting decision trees and visualizes these relationships as a three-dimensional graph structure, linking them progressively from lower levels. This system enables observation of ensemble models composed of multiple weak learners, as well as their transformations during the training and validation processes. An example of the operation of this system is presented by visualizing an ensemble model trained with synthetic data sets exhibiting typical distribution shifts, as well as real-world open data sets. As a result, we demonstrated that this approach enables a more accessible understanding of the behavior and structure of ensemble models. Moreover, facilitating the identification of overfitting and underfitting, and detection of outliers within the dataset. User testing further demonstrated the effectiveness of this visualization method. © The Author(s) 2025","ensemble model; layered graph; machine learning; MLOps; Visualization","Data visualization; Decision trees; Failure analysis; Reliability analysis; Reliability theory; Ensemble models; Interactive 3d visualizations; Interpretability; Layered graphs; Machine-learning; MLOp; Overfitting; Tree-based; Visualization method; Weak learner; Flow visualization","Article","Final","","Scopus","2-s2.0-105004432392"
