"Authors","Author full names","Author(s) ID","Title","Year","Source title","Volume","Issue","Art. No.","Page start","Page end","Cited by","DOI","Link","Abstract","Author Keywords","Index Keywords","Document Type","Publication Stage","Open Access","Source","EID"
"Ismail A.R.; Azlan F.F.; Noormaizan K.A.; Afiqa N.; Nisa S.Q.; Ghazali A.B.; Pranolo A.; Saifullah S.","Ismail, Amelia Ritahani (36995749000); Azlan, Faris Farhan (60001354800); Noormaizan, Khairul Akmal (60001806000); Afiqa, Nurul (60001806100); Nisa, Syed Qamrun (57216771689); Ghazali, Ahmad Badaruddin (60000667700); Pranolo, Andri (56572821900); Saifullah, Shoffan (57194569205)","36995749000; 60001354800; 60001806000; 60001806100; 57216771689; 60000667700; 56572821900; 57194569205","Privacy-preserving U-Net variants with pseudo-labeling for radiolucent lesion segmentation in dental CBCT","2025","International Journal of Advances in Intelligent Informatics","11","2","","275","291","1","10.26555/ijain.v11i2.1529","https://www.scopus.com/pages/publications/105010912204?origin=resultslist","Accurate segmentation of radiolucent lesions in dental Cone Beam Computed Tomography (CBCT) is vital for enhancing diagnostic reliability and reducing the burden on clinicians. This study proposes a privacy preserving segmentation framework leveraging multiple U-Net variants U-Net, DoubleU-Net, U2-Net, and Spatial Attention U-Net (SA-UNet) to address challenges posed by limited labeled data and patient confidentiality concerns. To safeguard sensitive information, Differential Privacy Stochastic Gradient Descent (DP-SGD) is integrated using TensorFlow-Privacy, achieving a privacy budget of ε ≈ 1.5 with minimal performance degradation. Among the evaluated architectures, U2-Net demonstrates superior segmentation performance with a Dice coefficient of 0.833 and an Intersection over Union (IoU) of 0.881, showing less than 2% reduction under privacy constraints. To mitigate data annotation scarcity, a pseudo-labeling approach is implemented within an MLOps pipeline, enabling semi-supervised learning from unlabeled CBCT images. Over three iterative refinements, the pseudo labeling strategy reduces validation loss by 14.4% and improves Dice score by 2.6%, demonstrating its effectiveness. Additionally, comparative evaluations reveal that SA-UNet offers competitive accuracy with faster inference time (22 ms per slice), making it suitable for low-resource deployments. The proposed approach presents a scalable and privacy-compliant framework for radiolucent lesion segmentation, supporting clinical decision-making in real-world dental imaging scenarios. © 2025 The Author(s).","Dental CBCT; Differential privacy; Pseudo-Labeling; Radiolucent lesion segmentation; U-Net variants","","Article","Final","All Open Access; Gold Open Access; Green Open Access","Scopus","2-s2.0-105010912204"
"Jägare U.","Jägare, Ulrika (59362246100)","59362246100","Operating AI: Bridging the Gap Between Technology and Business","2024","Operating Ai: Bridging the Gap Between Technology and Business","","","","1","252","2","","https://www.scopus.com/pages/publications/85206024171?origin=resultslist","A holistic and real-world approach to operationalizing artificial intelligence in your company In Operating AI, Director of Technology and Architecture at Ericsson AB, Ulrika Jägare, delivers an eye-opening new discussion of how to introduce your organization to artificial intelligence by balancing data engineering, model development, and AI operations. You'll learn the importance of embracing an AI operational mindset to successfully operate AI and lead AI initiatives through the entire lifecycle, including key areas such as; data mesh, data fabric, aspects of security, data privacy, data rights and IPR related to data and AI models. In the book, you’ll also discover: How to reduce the risk of entering bias in our artificial intelligence solutions and how to approach explainable AI(XAI) The importance of efficient and reproduceable data pipelines, including how to manage your company's data An operational perspective on the development of AI models using the MLOps(Machine Learning Operations) approach, including how to deploy, run and monitor models and ML pipelines in production using CI/CD/CT techniques, that generates value in the real world Key competences and toolsets in AI development, deployment and operations What to consider when operating different types of AI business models With a strong emphasis on deployment and operations of trustworthy and reliable AI solutions that operate well in the real world—and not just the lab—Operating AI is a must-read for business leaders looking for ways to operationalize an AI business model that actually makes money, from the concept phase to running in a live production environment. © 2022 by John Wiley & Sons, Inc. All rights reserved.","","","Book","Final","","Scopus","2-s2.0-85206024171"
"Matsuno R.","Matsuno, Ryuta (57216897836)","57216897836","GBCE: Enhanced Training Loss to Estimate Accuracy of Models in Production","2025","Lecture Notes in Computer Science","15872 LNAI","","","29","40","0","10.1007/978-981-96-8180-8_3","https://www.scopus.com/pages/publications/105009812780?origin=resultslist","Accuracy estimation is crucial for reliable real-world machine learning applications, particularly when the target labels are observed with delay. This paper proposes a novel guided binary cross-entropy (GBCE) loss designed explicitly for training a “check model,” i.e., a model dedicated to checking predictions to estimate accuracy. The GBCE loss focuses on learning prediction probabilities for predicted labels, which is critical for accuracy estimation. Compared to the cross-entropy (CE) loss, which is commonly employed in related methods, the GBCE loss directly minimizes the upper bound of the accuracy estimation error. We theoretically analyze our method, providing its generalization error bound. Our numerical experiments further validate our GBCE-based accuracy estimation, demonstrating its superior performance by reducing accuracy estimation error by up to 30.2%. © The Author(s), under exclusive license to Springer Nature Singapore Pte Ltd. 2025.","MLOps; Monitoring; Unsupervised accuracy estimation","Artificial intelligence; Data accuracy; Entropy; Learning systems; Signal processing; Accuracy estimation; Cross entropy; Enhanced training; Entropy loss; Estimate accuracy; Estimation errors; Machine learning applications; MLOp; Real-world; Unsupervised accuracy estimation; Errors","Conference paper","Final","","Scopus","2-s2.0-105009812780"
"Long Y.; Kroeger S.; Zaeh M.F.; Brintrup A.","Long, Yunbo (59361452700); Kroeger, Sebastian (57751458800); Zaeh, Michael F. (14016941300); Brintrup, Alexandra (8837745700)","59361452700; 57751458800; 14016941300; 8837745700","Leveraging synthetic data to tackle machine learning challenges in supply chains: challenges, methods, applications, and research opportunities","2025","International Journal of Production Research","","","","","","32","10.1080/00207543.2024.2447927","https://www.scopus.com/pages/publications/85214388396?origin=resultslist","Machine learning (ML) has the potential to improve various supply chain management (SCM) tasks, namely demand forecasting, risk management, inventory management, production planning and control, supply network reconstruction, and distribution and logistics. However, the industrial application of ML in supply chains faces many challenges, particularly in data privacy and data scarcity. Synthetic data, which is artificially generated to mimic real-world data patterns, has shown promise in overcoming similar challenges in fields such as healthcare and finance. However, the application of synthetic data in the context of supply chains remains limited. This publication aims to analyze the challenges of machine learning operations (MLOps) for supply chain tasks and explain how synthetic data can address these challenges in a supply chain context. Moreover, the publication aims to identify suitable approaches to generate synthetic supply chain data. Based on the analysis, a research agenda is proposed as a guideline for future research activities to enable the use of synthetic data in the context of supply chains. © 2025 The Author(s). Published by Informa UK Limited, trading as Taylor & Francis Group.","data generation; generative AI; Machine learning; MLOps; supply chain; synthetic data","Chain management; Data generation; Demand forecasting; Generative AI; Machine learning operation; Machine-learning; Management tasks; Research opportunities; Synthetic data","Article","Article in press","","Scopus","2-s2.0-85214388396"
"Moreschini S.; Arvanitou E.-M.; Kanidou E.-P.; Nikolaidis N.; Su R.; Ampatzoglou A.; Chatzigeorgiou A.; Lenarduzzi V.","Moreschini, Sergio (57196187277); Arvanitou, Elvira-Maria (55209903200); Kanidou, Elisavet-Persefoni (60087459800); Nikolaidis, Nikolaos (57212149454); Su, Ruoyu (58602252500); Ampatzoglou, Apostolos (16027681600); Chatzigeorgiou, Alexander (6701702023); Lenarduzzi, Valentina (55348964400)","57196187277; 55209903200; 60087459800; 57212149454; 58602252500; 16027681600; 6701702023; 55348964400","The Evolution of Technical Debt from DevOps to Generative AI: A multivocal literature review","2026","Journal of Systems and Software","231","","112599","","","2","10.1016/j.jss.2025.112599","https://www.scopus.com/pages/publications/105015139846?origin=resultslist","Background: The rapid integration of Artificial Intelligence (AI) – including Machine Learning (ML) and Generative AI – into software systems is reshaping the software development lifecycle. As AI-driven systems become more dynamic and complex, traditional approaches to Technical Debt (TD) management face increasing limitations. Simultaneously, AI-assisted development introduces new forms of TD, particularly in relation to maintainability, explainability, and data governance. Objective: This study aims to explore how Technical Debt Management (TDM) must adapt in the context of AI-enhanced software development. It investigates (1) the evolution of TD in AI-driven systems, and (2) the implications of using AI technologies within the software engineering process. Methods: We conducted a multivocal literature review, combining insights from both peer-reviewed research and industry sources. Following established guidelines, we systematically analyzed 61 primary sources, categorized TD types and management activities, and identified key challenges and practices emerging in the AI era. Results: Our findings reveal that data-related, infrastructure, and pipeline-related TD are particularly prevalent in ML systems. Machine Learning Operations (MLOps) practices are increasingly recognized as essential for managing such debt, especially in relation to dynamic data dependencies and model retraining. In parallel, AI-generated artifacts and automated pipelines introduce new governance and maintainability challenges. Conclusion: Technical Debt in AI systems demands continuous, automated, and cross-functional management strategies. As software evolves in response to data and usage, new operational paradigms – grounded in practices like MLOps and Small Language Model Operations (SLMOps) – will be vital to ensure long-term software sustainability. This study provides a foundational map for researchers and practitioners navigating the intersection of AI and TD management. © 2025 The Authors","Multivocal literature review; Technical debt","Engineering education; Industrial research; Information management; Learning systems; Life cycle; Machine learning; Maintainability; Reviews; Software design; Driven system; Literature reviews; Machine-learning; Multivocal literature review; New forms; Software development life-cycle; Software-systems; Technical debts; Traditional approaches; Traditional approachs; Pipelines","Article","Final","All Open Access; Green Open Access; Hybrid Gold Open Access","Scopus","2-s2.0-105015139846"
"Amistapuram K.; Pandiri L.; Raju V.R.; Paleti S.; Singireddy S.; Sheelam G.K.","Amistapuram, Keerthi (60507659600); Pandiri, Lahari (59988238600); Raju, Vijaya Rama (60619346300); Paleti, Srinivasarao (60133192200); Singireddy, Sneha (59988621100); Sheelam, Goutham Kumar (60132841100)","60507659600; 59988238600; 60619346300; 60133192200; 59988621100; 60132841100","AI-Based Cloud Infrastructure and MLOps Frameworks for Scalable Data Engineering Across Banking and Insurance","2025","2025 IEEE International Conference on Communication Networks and Computing, CNC 2025","","","","186","192","0","10.1109/CNC68716.2025.11484532","https://www.scopus.com/pages/publications/105038037415?origin=resultslist","This study suggests the use of AI in cloud environments for easy and automated data management in the insurance and banking industries. Because financial institutions now deal with more data and analytics on the fly, making the most of cloud-native integration with MLOps helps them achieve automated, scalable and efficient processes. Testing is done in the study by using four main algorithms - Random Forest, XGBoost, Support Vector Machine and Artificial Neural Network - on a stock market dataset meant to display real-world cases like fraud and credit risk. It was found that with an accuracy of 94.7%, XGBoost performed the best compared to Random Forest (92.3%), ANN (90.1%) and SVM (87.6%). With MLOps standalone pipelines, the organization could train new models and deploy them automatically, reducing the time it took by 40% and boosting the system's uptime by 35%. Assessing the method against other approaches revealed that it worked much faster and was more accurate at the same time. Using cloud services and automation simultaneously allowed them to streamline activities and use data more effectively in their choices. As a result, it's obvious that using MLOps and cloud-based AI is necessary for changing data engineering in finance.  © 2025 IEEE.","Banking; Cloud Infrastructure; Insurance; MLOps; Scalable Data Engineering","Automation; Cloud analytics; Electronic trading; Information management; Neural networks; Statistical tests; Support vector machines; Automated data management; Banking industry; Cloud environments; Cloud infrastructures; Data engineering; Financial institution; Insurance industry; MLOp; Random forests; Scalable data engineering; Banking; Insurance","Conference paper","Final","","Scopus","2-s2.0-105038037415"
"Naga Karthik E.; Bédard S.; Valošek J.; Aigner C.S.; Bannier E.; Bednařík J.; Callot V.; Combes A.; Curt A.; David G.; Eippert F.; Farner L.; Fehlings M.G.; Freund P.; Granberg T.; Granziera C.; Horn U.; Horák T.; Humphreys S.; Hupp M.; Kerbrat A.; Kinany N.; Kolind S.; Kudlička P.; Lebret A.; Lee L.E.; Mainero C.; Martin A.R.; McGrath M.; Nair G.; O’Grady K.P.; Oh J.; Ouellette R.; Pfender N.; Pfyffer D.; Pradat P.-F.; Prat A.; Pravatà E.; Reich D.S.; Ricchi I.; Rotem-Kohavi N.; Schading-Sassenhausen S.; Seif M.; Smith A.; Smith S.A.; Sweeney G.; Tam R.; Traboulsee A.; Treaba C.A.; Tsagkas C.; Vavasour Z.; Van De Ville D.; Weber II K.A.; Chandar S.; Cohen-Adad J.","Naga Karthik, Enamundram (57215843471); Bédard, Sandrine (57352046900); Valošek, Jan (57076959600); Aigner, Christoph S. (57044480100); Bannier, Elise (35214457900); Bednařík, Josef (7005907261); Callot, Virginie (55930647800); Combes, Anna (56919372300); Curt, Armin (7006759480); David, Gergely (57188986656); Eippert, Falk (16303816200); Farner, Lynn (58899801900); Fehlings, Michael G (7005942578); Freund, Patrick (14037413900); Granberg, Tobias (55607147200); Granziera, Cristina (15059152300); Horn, Ulrike (57188570929); Horák, Tomáš (57196033148); Humphreys, Suzanne (57196067405); Hupp, Markus (55214495200); Kerbrat, Anne (49661802900); Kinany, Nawal (57195481314); Kolind, Shannon (13104405000); Kudlička, Petr (57222812267); Lebret, Anna (58576793000); Lee, Lisa Eunyoung (57209520692); Mainero, Caterina (6602755770); Martin, Allan R. (57013854300); McGrath, Megan (59166148300); Nair, Govind (8944473800); O’Grady, Kristin P. (57202653402); Oh, Jiwon (57532661700); Ouellette, Russell (57191989654); Pfender, Nikolai (35730256300); Pfyffer, Dario (57211262808); Pradat, Pierre-François (56240768300); Prat, Alexandre (7103277065); Pravatà, Emanuele (35108142200); Reich, Daniel S. (7102312699); Ricchi, Ilaria (57224814274); Rotem-Kohavi, Naama (55646972900); Schading-Sassenhausen, Simon (58827647900); Seif, Maryam (57203617248); Smith, Andrew (7406757761); Smith, Seth A (55414050800); Sweeney, Grace (58666144900); Tam, Roger (7006808600); Traboulsee, Anthony (6602953194); Treaba, Constantina Andrada (56056542600); Tsagkas, Charidimos (57192070466); Vavasour, Zachary (59294875900); Van De Ville, Dimitri (6701694895); Weber II, Kenneth Arnold (55344615500); Chandar, Sarath (57073680500); Cohen-Adad, Julien (24777793300)","57215843471; 57352046900; 57076959600; 57044480100; 35214457900; 7005907261; 55930647800; 56919372300; 7006759480; 57188986656; 16303816200; 58899801900; 7005942578; 14037413900; 55607147200; 15059152300; 57188570929; 57196033148; 57196067405; 55214495200; 49661802900; 57195481314; 13104405000; 57222812267; 58576793000; 57209520692; 6602755770; 57013854300; 59166148300; 8944473800; 57202653402; 57532661700; 57191989654; 35730256300; 57211262808; 56240768300; 7103277065; 35108142200; 7102312699; 57224814274; 55646972900; 58827647900; 57203617248; 7406757761; 55414050800; 58666144900; 7006808600; 6602953194; 56056542600; 57192070466; 59294875900; 6701694895; 55344615500; 57073680500; 24777793300","Monitoring morphometric drift in lifelong learning segmentation of the spinal cord","2026","Imaging Neuroscience","4","","","","","1","10.1162/IMAG.a.1105","https://www.scopus.com/pages/publications/105030857501?origin=resultslist","Morphometric measures derived from spinal cord segmentations can serve as diagnostic and prognostic biomarkers in neurological diseases and injuries affecting the spinal cord. For instance, the spinal cord cross-sectional area can be used to monitor cord atrophy in multiple sclerosis and to characterize compression in degenerative cervical myelopathy. While robust, automatic segmentation methods to a wide variety of contrasts and pathologies have been developed over the past few years, whether their predictions are stable as the model is updated using new datasets has not been assessed. This is particularly important for deriving normative values from healthy participants. In this study, we present a spinal cord segmentation model trained on a multisite (n = 75 sites, 1,631 participants) dataset, including 9 different MRI contrasts and several spinal cord pathologies. We also introduce a lifelong learning framework to automatically monitor the morphometric drift as the model is updated using additional datasets. The framework is triggered by an automatic GitHub Actions workflow every time a new model is created, recording the morphometric values derived from the model’s predictions over time. As a real-world application of the proposed framework, we employed the spinal cord segmentation model to update a recently introduced normative database of healthy participants containing commonly used measures of spinal cord morphometry. Results showed that (i) our model performs well compared with its previous versions and existing pathology-specific models on the lumbar spinal cord, images with severe compression, and in the presence of intramedullary lesions and/or atrophy achieving an average Dice score of 0.95 ± 0.03; (ii) the automatic workflow for monitoring morphometric drift provides a quick feedback loop for developing future segmentation models; and (iii) the scaling factor required to update the database of morphometric measures is nearly constant among slices across the given vertebral levels, showing minimum drift between the current and previous versions of the model monitored by the framework. The code and model are open source and accessible via Spinal Cord Toolbox v7.0. © 2026 The Authors. Published under a Creative Commons Attribution 4.0 International (CC BY 4.0) license.. This is an open-access article distributed under the terms of the Creative Commons Attribution 4.0 International (CC BY 4.0) license, which permits unrestricted use, distribution, and reproduction in any medium, provided the original work is properly cited. For a full description of the license, please visit https://creativecommons.org/licenses/by/4.0/legalcode.","lifelong learning; MLOps; morphometric drift; MRI; segmentation; spinal cord","","Article","Final","All Open Access; Gold Open Access; Green Open Access","Scopus","2-s2.0-105030857501"
"Mamta","Mamta (60627410600)","60627410600","Describing Decisive Digital Transformation Technologies and Tools","2026","Next-Generation Recommendation Systems: A Comprehensive Guide to Enabling Technologies and Tools and their Business Benefits","","","","1","20","0","10.1002/9781394351572.ch1","https://www.scopus.com/pages/publications/105038510773?origin=resultslist","Due to digital transformation, recommendation systems have experienced significant transformation through novel technologies and instruments. This chapter examines the critical technological foundations that drive modern recommendation engines, focusing on three key areas: infrastructure technologies, development frameworks, and deployment solutions. Issues like cloud operations, microservices, and MLOps paradigms, which are relevant to optimizing recommendation solutions, are discussed in the analytical part. Real-time processing and today's advanced solutions in data management are shown through the case studies of applications. Hence, the chapter gives the decision-makers and developers practical recommendations on how to build reliable modern recommendation systems that meet the dynamic customer needs and are deployable across various platforms. © 2026 by John Wiley & Sons Inc. All rights reserved.","Cloud computing; Digitalization of industries; MLOps; Real-time data processing; Recommendation system","Cloud computing; Data handling; Information management; Metadata; Real time systems; Cloud-computing; Development frameworks; Digital transformation; Digitalization of industry; Infrastructure technologies; MLOp; Real-time data processing; Technology development; Transformation technologies; Transformation tools; Recommender systems","Book chapter","Final","","Scopus","2-s2.0-105038510773"
"Chen T.","Chen, Tianyi (59224623200)","59224623200","Challenges and Opportunities in Integrating LLMs into Continuous Integration/Continuous Deployment (CI/CD) Pipelines","2024","2024 5th International Seminar on Artificial Intelligence, Networking and Information Technology, AINIT 2024","","","","364","367","30","10.1109/AINIT61980.2024.10581784","https://www.scopus.com/pages/publications/85199208369?origin=resultslist","Large Language Models (LLMs) are powerful neural network models that can perform various language-related tasks by generating natural language conditioned on a given input or prompt. However, LLMs also pose significant challenges and risks for their development, deployment, and maintenance, such as computational cost, error and bias, and ethical and social implications. In this paper, we explore the challenges and opportunities in integrating LLMs into Continuous Integration/Continuous Deployment (CI/CD) pipelines, which are automated workflows that enable the delivery of software products or services in a fast, reliable, and consistent manner. We propose a framework for LLMOps, a specialized branch of MLOps that focuses on the development, deployment, and maintenance of LLMs. We demonstrate the use of LLMOps in a case study, where we integrate a LLM into a CI/CD pipeline for a text summarization task. We evaluate the performance, usage, and feedback of the LLM, and show that the LLM improved its quality and reliability after incorporatingthe human feedback loop. We also discuss the ethical and social implications of deploying LLMs in real-world applications, and provide recommendations and directions for future work. © 2024 IEEE.","Continuous Integration/Continuous Deployment; Human Feedback Loop; Large Language Models; LLMOps; Text Summarization","Computational linguistics; Natural language processing systems; Neural network models; Philosophical aspects; Social aspects; Text processing; Continuous integration/continuous deployment; Continuous integrations; Ethical implications; Feedback loops; Human feedback loop; Language model; Large language model; LLMOp; Social implication; Text Summarisation; Pipelines","Conference paper","Final","","Scopus","2-s2.0-85199208369"
